{
  "schemaVersion": "uplb-model-source-registry-v0.1",
  "generatedAt": "2026-08-17",
  "policy": {
    "canonicalWorldSource": "Git-controlled reviewed geodata and scene specifications",
    "modelEvidenceRule": "A reference may guide reconstruction without granting redistribution rights to its source asset.",
    "licenseRule": "No third-party mesh or image enters shipped assets without an explicit reusable license or recorded permission.",
    "restrictedRule": "Google Street View imagery, Google 3D geometry, and other restricted imagery are not automated ingestion sources.",
    "sourcePriority": [
      "institutional-original",
      "licensed-existing-model",
      "authorized-reality-capture",
      "licensed-photography",
      "reviewed-measurements",
      "procedural-reference"
    ]
  },
  "sources": [
    {
      "id": "source:legacy:uplb-virtual-campus-2014",
      "title": "Design, Implementation, and Evaluation of a 3D Virtual Classroom Environment in a Computer Cluster",
      "kind": "legacy-project-evidence",
      "provider": "UPLB / ISCE 2014 authors",
      "url": "https://id.scribd.com/document/990184030/ISCE2014-Proceedings-FINAL3",
      "rightsStatus": "reference-only",
      "reuseStatus": "permission-required-for-original-model-files",
      "evidence": [
        "Paper states UPLB building models were patterned from architectural blueprints.",
        "Paper states Google SketchUp and Blender were used.",
        "Figures identify Baker Hall, Biological Sciences, CAS Annexes 1/2, Main Library, Physical Sciences, CEAT, CEM, CDC, DL Umali, Student Union, Mariang Banga, Oblation Park, Freedom Park, and UPLB Gate."
      ],
      "nextAction": "Contact UPLB ICS/CINTERLABS, project authors, and institutional archives for original .skp/.blend/.dae assets and blueprint-use provenance."
    },
    {
      "id": "source:news:cinterlabs-2014",
      "title": "CINTERLABS showcases 3D avatar-based virtual environment program",
      "kind": "legacy-project-evidence",
      "provider": "Los Baños Times",
      "url": "https://lbtimes.ph/cinterlabs-showcases-3d-avatar-based-virtual-environment-program/",
      "rightsStatus": "reference-only",
      "reuseStatus": "reference-only",
      "evidence": [
        "Contemporary report confirms the UPLB virtual campus beta and finished navigation assets for Main Library, Student Union, CAS, CAS Annexes 1/2, Physical Sciences, and Biological Sciences."
      ],
      "nextAction": "Use as corroboration when requesting recovery of the legacy project archive."
    },
    {
      "id": "source:scan:sketchfab-oblation-2025",
      "title": "UPLB Oblation 3D model",
      "kind": "existing-3d-scan-lead",
      "provider": "Sketchfab / leobar",
      "url": "https://sketchfab.com/3d-models/uplb-oblation-cba18bfbafdf49779e484f767dc9fe5d",
      "rightsStatus": "permission-required",
      "reuseStatus": "license-not-verified",
      "evidence": [
        "Published 2025.",
        "Approximately 797.8k triangles / 405k vertices.",
        "Description states capture from a DJI O3 Air Unit."
      ],
      "nextAction": "Contact creator for original asset, capture methodology, and explicit reuse/derivative permission."
    },
    {
      "id": "source:scan:sketchfab-physci-2025",
      "title": "UPLB Physical Sciences Building 3D model",
      "kind": "existing-3d-scan-lead",
      "provider": "Sketchfab / leobar",
      "url": "https://sketchfab.com/3d-models/uplb-physical-sciences-building-5c154f0033dd4ff3b13a5aab1ebfbe50",
      "rightsStatus": "permission-required",
      "reuseStatus": "license-not-verified",
      "evidence": [
        "Published 2025.",
        "Approximately 1M triangles / 504.9k vertices."
      ],
      "nextAction": "Contact creator; if permission is granted, retain scan as high-poly evidence/master input and generate optimized derivatives rather than shipping the raw scan."
    },
    {
      "id": "source:uplb:phil-lidar-building-footprints",
      "title": "BERTUD: Building footprint extraction and regularization in LiDAR data",
      "kind": "institutional-lidar-lead",
      "provider": "UPLB Phil-LiDAR 1 / UKDR",
      "url": "https://www.ukdr.uplb.edu.ph/journal-articles/1657/",
      "rightsStatus": "access-unknown",
      "reuseStatus": "permission-or-dataset-terms-required",
      "evidence": [
        "UPLB Phil-LiDAR 1 processed building footprints from LiDAR datasets for Laguna and MIMAROPA."
      ],
      "nextAction": "Ask ERSG/Phil-LiDAR custodians whether campus-covering point clouds, DSM/DTM, or derived footprints can be used for academic/noncommercial reconstruction."
    },
    {
      "id": "source:uplb:seismic-audit-2021",
      "title": "Seismic audit of important UPLB buildings—towards an earthquake resilient campus",
      "kind": "institutional-building-study",
      "provider": "UPLB CEAT / UKDR",
      "url": "https://www.ukdr.uplb.edu.ph/professorial_lectures/436/",
      "rightsStatus": "reference-only",
      "reuseStatus": "bibliographic-and-factual-reference",
      "evidence": [
        "Study references a prior risk assessment covering 67 of 165 UPLB buildings and notes structural-plan availability constraints."
      ],
      "nextAction": "Use building lists, construction-era information, and any lawfully available dimensions only; request plans separately where appropriate."
    },
    {
      "id": "source:uplb:main-library-pushover-2016",
      "title": "Nonlinear static pushover analysis of the UPLB Main Library",
      "kind": "institutional-building-study",
      "provider": "UPLB CEAT / UKDR",
      "url": "https://www.ukdr.uplb.edu.ph/etd-undergrad/5515/",
      "rightsStatus": "reference-only",
      "reuseStatus": "bibliographic-and-factual-reference",
      "evidence": [
        "Abstract identifies Main Library as a four-storey reinforced-concrete building built in 1970."
      ],
      "nextAction": "Use only disclosed factual dimensions/era information unless full-document use is separately authorized."
    },
    {
      "id": "source:uplb:uhs-pushover-2016",
      "title": "Nonlinear static pushover analysis of the UPLB University Health Services Main Building",
      "kind": "institutional-building-study",
      "provider": "UPLB CEAT / UKDR",
      "url": "https://www.ukdr.uplb.edu.ph/etd-undergrad/5523/",
      "rightsStatus": "reference-only",
      "reuseStatus": "bibliographic-and-factual-reference",
      "evidence": [
        "Abstract identifies UHS Main Building as approximately 8 m tall, two storeys, reinforced concrete, built in 1971."
      ],
      "nextAction": "Use disclosed factual information as a model-source clue; verify present-day condition before production."
    },
    {
      "id": "source:image:commons-baker-2017",
      "title": "UPLB Baker Hall, 2017-02-16",
      "kind": "licensed-photography",
      "provider": "Wikimedia Commons / Patrick Roque",
      "url": "https://commons.wikimedia.org/wiki/File:University_of_the_Philippines_(UPLB)_-_Baker_Hall_(Los_Baños,_Laguna;_2017-02-16).jpg",
      "rightsStatus": "open-attribution-sharealike",
      "reuseStatus": "CC-BY-SA-4.0",
      "evidence": [
        "High-resolution 3648×2736 facade/reference photograph.",
        "File page specifies CC BY-SA 4.0."
      ],
      "nextAction": "Use for facade reference only if derivative obligations are understood and recorded; keep image attribution in the source manifest."
    },
    {
      "id": "source:image:commons-baker-2023",
      "title": "UPLB Baker Memorial Hall, June 2023",
      "kind": "licensed-photography",
      "provider": "Wikimedia Commons / Ralff Nestor Nacor",
      "url": "https://commons.wikimedia.org/wiki/File:UPLB_Baker_Memorial_Hall,_June_2023.jpg",
      "rightsStatus": "open-license-check-file-page",
      "reuseStatus": "verify-exact-commons-license-before-derivative",
      "evidence": [
        "4080×3072 recent exterior reference photograph."
      ],
      "nextAction": "Pin exact license/author metadata before any texture or derivative-image workflow."
    },
    {
      "id": "tool:realityscan",
      "title": "RealityScan",
      "kind": "reconstruction-tool",
      "provider": "Epic Games",
      "url": "https://www.realityscan.com/",
      "rightsStatus": "tool-terms",
      "reuseStatus": "tool-only",
      "evidence": [
        "Current product supports image/laser-scan reconstruction and automation workflows."
      ],
      "nextAction": "Use for authorized hero-building capture when source recovery fails."
    },
    {
      "id": "tool:colmap",
      "title": "COLMAP 4.x",
      "kind": "reconstruction-tool",
      "provider": "COLMAP project",
      "url": "https://github.com/colmap/colmap",
      "rightsStatus": "permissive-open-source",
      "reuseStatus": "BSD-3-Clause-tool",
      "evidence": [
        "Supports SfM, dense MVS, Poisson/Delaunay meshing, QEM simplification, and mesh texture mapping."
      ],
      "nextAction": "Use as reproducible/open photogrammetry path and as a validation alternative to proprietary reconstruction tools."
    }
  ]
}
